{
  "$schema": "http://json-schema.org/draft-07/schema#",
  "type": ["object", "null"],
  "title": "Case Schema",
  "description": "Schema for Case components",
  "required": ["metadata"],
  "properties": {
    "opendb_id": {
      "type": ["string", "null"],
      "description": "Unique identifier for the document (UUID v4)"
    },
    "form_factor": {
      "description": "The form factor of the case (e.g., ATX Mid Tower, Full Tower, Mini-ITX)",
      "type": ["string", "null"],
      "enum": [
        "ATX Full Tower",
        "ATX Mid Tower",
        "ATX Mini Tower",
        "ATX Desktop",
        "ATX Test Bench",
        "EATX Full Tower",
        "EATX Mid Tower",
        "Micro ATX Mid Tower",
        "Micro ATX Mini Tower",
        "Micro ATX Desktop",
        "Micro ATX Slim Tower",
        "Mini ITX Tower",
        "Mini ITX Desktop",
        "Mini ITX Test Bench",
        "HTPC",
        "Open Frame",
        null
      ]
    },
    "supported_motherboard_form_factors": {
      "description": "Array of motherboard form factors this case can accommodate (e.g., ['ATX', 'Micro ATX', 'Mini-ITX'])",
      "type": ["array", "null"],
      "items": {
        "type": "string",
        "enum": [
          "ATX",
          "Micro ATX",
          "Mini-ITX",
          "EATX",
          "Mini DTX",
          "DTX",
          "SSI EEB",
          "SSI CEB",
          "XL ATX",
          "HPTX",
          "Thin Mini-ITX",
          "Flex ATX"
        ]
      }
    },
    "color": {
      "description": "The color(s) of this product. Each color of the product should be included in the array. Do not use RGB here to describe lighting; use the Lighting field for RGB, ARGB, display, or fixed-color lighting. Includes exterior and interior colors",
      "type": ["array", "null"],
      "items": {
        "type": "string",
        "enum": [
          "BLACK",
          "WHITE",
          "RGB",
          "RED",
          "BLUE",
          "GREEN",
          "GREY",
          "YELLOW",
          "ORANGE",
          "PURPLE",
          "PINK",
          "BROWN",
          "GOLD"
        ]
      }
    },
    "lighting": {
      "description": "Lighting capabilities for this product. Use RGB for non-addressable RGB, ARGB for addressable RGB, Multicolor for non-RGB multi-color lighting, Fixed for a single fixed lighting color, None when the product has no lighting, Display for configurable displays, and Fixed Color Display for displays limited to fixed colors such as black and white.",
      "type": ["array", "null"],
      "items": {
        "type": "string",
        "enum": ["RGB", "ARGB", "Multicolor", "Fixed", "None", "Display", "Fixed Color Display"]
      }
    },
    "power_supply": {
      "description": "If included with the case, could detail the PSU model.",
      "type": ["string", "null"]
    },
    "power_supply_included": {
      "description": "Whether the case includes a power supply.",
      "type": ["boolean", "null"]
    },
    "supported_power_supply_form_factors": {
      "description": "The PSU form factors that the case can support.",
      "type": ["array", "null"],
      "items": {
        "type": "string"
      }
    },
    "side_panel": {
      "description": "The type of side panel (e.g., Tempered Glass, Acrylic, Solid)",
      "type": ["string", "null"],
      "enum": [
        "Tempered Glass",
        "Acrylic",
        "Mesh",
        "Solid",
        "None",
        "Tinted Tempered Glass",
        "Tinted Acrylic",
        "Aluminum",
        "Steel",
        null
      ]
    },
    "has_transparent_side_panel": {
      "description": "Whether the case has a transparent side panel",
      "type": ["boolean", "null"]
    },
    "front_panel_usb": {
      "description": "Legacy front panel USB descriptor (deprecated). Deprecated field. Populate front_usb_ports instead.",
      "type": ["string", "null"]
    },
    "front_usb_ports": {
      "description": "Array of front panel USB port types",
      "type": ["array", "null"],
      "items": {
        "type": "string"
      }
    },
    "max_video_card_length": {
      "description": "The maximum supported video card length in mm",
      "type": ["number", "null"]
    },
    "max_cpu_cooler_height": {
      "description": "The maximum supported CPU cooler height in mm",
      "type": ["number", "null"]
    },
    "max_psu_length": {
      "description": "The maximum supported power supply length in mm",
      "type": ["number", "null"]
    },
    "internal_3_5_bays": {
      "description": "The number of internal 3.5\" drive bays",
      "type": ["number", "null"]
    },
    "internal_2_5_bays": {
      "description": "The number of internal 2.5\" drive bays",
      "type": ["number", "null"]
    },
    "external_3_5_bays": {
      "description": "The number of external 3.5\" drive bays",
      "type": ["number", "null"]
    },
    "external_5_25_bays": {
      "description": "The number of external 5.25\" drive bays",
      "type": ["number", "null"]
    },
    "power_supply_shroud": {
      "description": "Whether the case has a power supply shroud",
      "type": ["boolean", "null"]
    },
    "expansion_slots": {
      "description": "The number of expansion slots",
      "type": ["number", "null"]
    },
    "riser_expansion_slots": {
      "description": "The number of riser expansion slots",
      "type": ["number", "null"]
    },
    "supports_rear_connecting_motherboard": {
      "description": "Whether the case supports rear connecting motherboard (BTF, Project Zero, etc)",
      "type": ["boolean", "null"]
    },
    "dimensions": {
      "description": "The dimensions of the case in mm (e.g., '466 x 290 x 495')",
      "type": ["string", "null"]
    },
    "dimensions_mm": {
      "description": "Structured dimensions in mm",
      "type": ["object", "null"],
      "properties": {
        "depth": {
          "description": "Part length (depth) in mm",
          "type": ["number", "null"]
        },
        "width": {
          "description": "Part width in mm",
          "type": ["number", "null"]
        },
        "height": {
          "description": "Part height in mm",
          "type": ["number", "null"]
        }
      }
    },
    "volume": {
      "description": "The internal volume of the case in liters",
      "type": ["number", "null"]
    },
    "weight": {
      "description": "Weight in pounds",
      "type": ["number", "null"]
    },
    "general_product_information": {
      "type": ["object", "null"],
      "description": "General product information and retailer SKUs",
      "properties": {
        "amazon_sku": {
          "type": ["string", "null"],
          "description": "Amazon product SKU"
        },
        "newegg_sku": {
          "type": ["string", "null"],
          "description": "Newegg product SKU"
        },
        "bestbuy_sku": {
          "type": ["number", "null"],
          "description": "Best Buy product SKU"
        },
        "walmart_sku": {
          "type": ["number", "null"],
          "description": "Walmart product SKU"
        },
        "adorama_sku": {
          "type": ["string", "null"],
          "description": "Adorama product SKU"
        },
        "ibuypower_sku": {
          "type": ["string", "null"],
          "description": "iBuyPower product SKU"
        },
        "hyte_sku": {
          "type": ["string", "null"],
          "description": "HYTE product SKU"
        },
        "manufacturer_url": {
          "type": ["string", "null"],
          "description": "Official manufacturer product URL"
        }
      }
    },
    "metadata": {
      "type": ["object", "null"],
      "properties": {
        "name": {
          "description": "Full product name",
          "type": ["string", "null"]
        },
        "manufacturer": {
          "description": "Case manufacturer",
          "type": ["string", "null"]
        },
        "part_numbers": {
          "description": "Array of manufacturer's part numbers/SKUs",
          "type": ["array", "null"],
          "items": {
            "type": "string"
          }
        },
        "series": {
          "description": "Product series name The manufacturer's product line / model name that groups related cases. Manufacturer and `form_factor` are stored separately and used as the default grouping, so do NOT repeat them in the series. The same family CAN span multiple form factors (`North` is its own series; `North XL` is a separate series, not a variant). Examples: 'Fractal Design North ATX Mid Tower' → series='North'. 'HYTE Y70 ATX Mid Tower Snow White' → series='Y70'. 'NZXT H3 Flow Micro ATX Mid Tower' → series='H3 Flow'.",
          "type": ["string", "null"]
        },
        "variant": {
          "description": "Specific variant in the series Most cases should have an empty variant — color/finish belongs in `manufacturer_color`, not here. Only set a variant when a sub-model needs to be distinguished from the base model within the same (manufacturer, series, form_factor) group: limited / collab editions that change more than paint, refreshed revisions, or named sub-models. Examples: 'Fractal Design North ATX Mid Tower Black' → variant='' (color is the only difference). 'Fractal Design North Momentum Edition' → variant='Momentum Edition'. 'Fractal Design North XL RC' → variant='RC'. The variant must be unique within a (manufacturer, series, form_factor, manufacturer_color) group — if every case collapses to the same value, leave it empty.",
          "type": ["string", "null"]
        },
        "releaseYear": {
          "description": "Year of release",
          "type": ["number", "null"]
        },
        "manufacturer_color": {
          "description": "Manufacturer's official color name for this product variant. The manufacturer's official marketed colorway name, verbatim — most case manufacturers brand their colorways. If the manufacturer doesn't give a fancy name, fall back to a simple human-readable color ('Black', 'White', 'White / Silver'). Branded / collab colorways belong here when the rest of the hardware is unchanged. Examples: HYTE Y70 in Snow White → 'Snow White'. Fractal Design North in Charcoal Black → 'Charcoal Black'. HYTE Y70 Persona 3 Reload Edition → 'Persona 3 Reload Edition'. Do NOT put hardware sub-model differentiators like 'Momentum Edition', 'RC', or 'Flow' in manufacturer_color — those are either the variant or part of the series.",
          "type": ["string", "null"]
        },
        "last_manually_spec_verified_at": {
          "type": ["string", "null"],
          "format": "date-time",
          "description": "ISO 8601 timestamp of when the part specs were last manually verified by a human"
        }
      },
      "required": ["name"]
    }
  }
}
