{
  "opendb_id": "fcde0de1-45eb-4863-8d57-a7ea75aa6d86",
  "metadata": {
    "name": "Cooler Master HAF 700 EVO ATX Full Tower Gray / Black with Tempered Glass Side Panel and USB 3.2 Gen 2 Type-C, USB 3.2 Gen 1 Type-A",
    "manufacturer": "Cooler Master",
    "part_numbers": [
      "H700E-IGNN-S00"
    ],
    "series": "HAF",
    "variant": ""
  },
  "form_factor": "ATX Full Tower",
  "color": [
    "GREY",
    "BLACK"
  ],
  "power_supply": "None",
  "side_panel": "Tempered Glass",
  "has_transparent_side_panel": true,
  "front_panel_usb": "USB 3.2 Gen 2 Type-C                                                    USB 3.2 Gen 1 Type-A",
  "max_video_card_length": 490,
  "max_cpu_cooler_height": null,
  "internal_3_5_bays": 12,
  "internal_2_5_bays": 0,
  "expansion_slots": 8,
  "dimensions": "",
  "volume": null,
  "weight": null,
  "supported_power_supply_form_factors": [],
  "front_usb_ports": [],
  "general_product_information": {
    "amazon_sku": "B09RVWCLRF",
    "newegg_sku": "N82E16811119433",
    "walmart_sku": 195933410
  }
}