{
  "opendb_id": "2d76e4dc-ce7f-453e-b72b-757c675a35f2",
  "metadata": {
    "name": "Corsair iCUE 5000T LX RGB ATX Mid Tower Black with Tempered Glass Side Panel and USB 3.2 Gen 2 Type-C, USB 3.2 Gen 1 Type-A",
    "manufacturer": "Corsair",
    "part_numbers": [
      "CC-9011298-WW"
    ],
    "series": "iCUE",
    "variant": ""
  },
  "form_factor": "ATX Mid Tower",
  "color": [
    "BLACK"
  ],
  "power_supply": "None",
  "side_panel": "Tempered Glass",
  "has_transparent_side_panel": true,
  "front_panel_usb": "USB 3.2 Gen 2 Type-C                                                    USB 3.2 Gen 1 Type-A",
  "max_video_card_length": 400,
  "max_cpu_cooler_height": null,
  "internal_3_5_bays": 2,
  "internal_2_5_bays": 4,
  "expansion_slots": 7,
  "dimensions": "530 x 251 x 560",
  "volume": 74.497,
  "weight": null,
  "general_product_information": {}
}