{
  "opendb_id": "7b2f80c6-b121-49d5-9335-883a14cd30ad",
  "metadata": {
    "name": " Thermaltake View 380 XL TG ARGB ATX Mid Tower Purple Tempered Glass (Future Dusk)",
    "manufacturer": "Thermaltake",
    "part_numbers": [
      "CA-11E-00MNWN-00"
    ],
    "series": "View",
    "variant": "380 XL"
  },
  "form_factor": "ATX Mid Tower",
  "color": [
    "BLACK"
  ],
  "power_supply": "None",
  "side_panel": "Tempered Glass",
  "has_transparent_side_panel": true,
  "front_panel_usb": "1x USB 3.2 Gen 2 Type-C                                                   2x USB 3.0",
  "front_usb_ports": [
    "1x USB 3.2 Gen 2 Type-C  ",
    "2x USB 3.0"
  ],
  "max_video_card_length": 420,
  "max_cpu_cooler_height": 160,
  "internal_3_5_bays": 1,
  "internal_2_5_bays": 2,
  "expansion_slots": 8,
  "supports_rear_connecting_motherboard": true,
  "dimensions": "471 x 288 x 469",
  "dimensions_mm": {
    "width": 288,
    "height": 471,
    "depth": 469,
    "_id": "690dfec5178d8ad1c56bc43c"
  },
  "volume": 63.619,
  "weight": 15.28,
  "supported_power_supply_form_factors": [],
  "general_product_information": {
    "amazon_sku": "B0FNGSKWJ2",
    "newegg_sku": "N82E16811133568",
    "walmart_sku": 18044671927,
    "manufacturer_url": "https://www.thermaltake.com/view-380-xl-tg-argb-future-dusk-mid-tower-chassis.html"
  }
}