{
  "opendb_id": "a4bbc38b-5290-407f-9b56-7d6411937a34",
  "metadata": {
    "name": "be quiet! Dark Base 701 ATX Mid Tower White Tempered Glass Side Panel",
    "manufacturer": "be quiet!",
    "part_numbers": [
      "BGW59"
    ],
    "series": "Dark",
    "variant": ""
  },
  "form_factor": "ATX Mid Tower",
  "color": [
    "WHITE"
  ],
  "power_supply": "None",
  "side_panel": "Tempered Glass",
  "has_transparent_side_panel": true,
  "front_panel_usb": "USB 3.2 Gen 2 Type-C                                                    USB 3.2 Gen 1 Type-A",
  "max_video_card_length": 430,
  "max_cpu_cooler_height": null,
  "internal_3_5_bays": 2,
  "internal_2_5_bays": 3,
  "expansion_slots": 7,
  "dimensions": "565 x 249 x 523",
  "volume": 73.578,
  "weight": null,
  "general_product_information": {
    "amazon_sku": "B0CWH7JTV8",
    "newegg_sku": "2AM-0037-000B7"
  }
}