{
  "opendb_id": "453eaca0-9cf1-4fcb-9c15-64d188ac59e1",
  "metadata": {
    "name": "Cooler Master CMP 510 ATX Mid Tower Black with Tempered Glass Side Panel and USB 3.2 Gen 1 Type-A USB 2.0 Type-A",
    "manufacturer": "Cooler Master",
    "part_numbers": [
      "CP510-KGNN-S00"
    ],
    "series": "CMP",
    "variant": ""
  },
  "form_factor": "ATX Mid Tower",
  "color": [
    "BLACK"
  ],
  "power_supply": "None",
  "side_panel": "Tempered Glass",
  "has_transparent_side_panel": true,
  "front_panel_usb": "USB 3.2 Gen 1 Type-AUSB 2.0 Type-A",
  "max_video_card_length": 350,
  "max_cpu_cooler_height": null,
  "internal_3_5_bays": 2,
  "internal_2_5_bays": 2,
  "expansion_slots": 7,
  "dimensions": "445 x 204 x 463",
  "volume": 42.031,
  "weight": null,
  "general_product_information": {}
}