{
  "opendb_id": "991b4095-9f25-4211-b446-482134a54b22",
  "metadata": {
    "name": "Jonsbo Jonsplus Z20 Micro ATX Desktop Pink / White with Tempered Glass Side Panel and USB 3.2 Gen 2 Type-C, USB 3.2 Gen 1 Type-A",
    "manufacturer": "Jonsbo",
    "part_numbers": [
      "Z20 Pink",
      "White                                                    Z20 WH-Pink"
    ],
    "series": "Jonsplus",
    "variant": ""
  },
  "form_factor": "Micro ATX Desktop",
  "color": [
    "PINK",
    "WHITE"
  ],
  "power_supply": "None",
  "side_panel": "Tempered Glass",
  "has_transparent_side_panel": true,
  "front_panel_usb": "USB 3.2 Gen 2 Type-C                                                    USB 3.2 Gen 1 Type-A",
  "max_video_card_length": 363,
  "max_cpu_cooler_height": null,
  "internal_3_5_bays": 1,
  "internal_2_5_bays": 2,
  "expansion_slots": 4,
  "dimensions": "382 x 198 x 335",
  "volume": 25.338,
  "weight": null,
  "general_product_information": {
    "newegg_sku": "2AM-05GF-00012"
  }
}