{
  "opendb_id": "bc567cc2-92cb-4a08-b04b-4069b625ed5e",
  "metadata": {
    "name": "Antec C8 ATX Full Tower White / Silver with Tempered Glass Side Panel and USB 3.2 Gen 2 Type-C, USB 3.2 Gen 1 Type-A",
    "manufacturer": "Antec",
    "part_numbers": [
      "0-761345-10093-9                                                    C8 AL White"
    ],
    "series": "C8",
    "variant": ""
  },
  "form_factor": "ATX Full Tower",
  "color": [
    "WHITE",
    "GREY"
  ],
  "power_supply": "None",
  "side_panel": "Tempered Glass",
  "has_transparent_side_panel": true,
  "front_panel_usb": "USB 3.2 Gen 2 Type-C                                                    USB 3.2 Gen 1 Type-A",
  "max_video_card_length": 440,
  "max_cpu_cooler_height": null,
  "internal_3_5_bays": 2,
  "internal_2_5_bays": 4,
  "expansion_slots": 8,
  "dimensions": "464 x 303 x 476",
  "volume": 66.922,
  "weight": null,
  "supported_power_supply_form_factors": [],
  "front_usb_ports": [],
  "general_product_information": {
    "amazon_sku": "B0D7ZGB5BB",
    "newegg_sku": "N82E16811129315"
  }
}