{
  "opendb_id": "bc5d8359-89a9-4a80-92b9-3ab05f3f1c80",
  "metadata": {
    "name": "Montech SKY TWO ATX Mid Tower Black Tempered Glass Side Panel",
    "manufacturer": "MONTECH",
    "part_numbers": [
      "SKY TWO Black                                                    SKY TWO BK"
    ],
    "series": "SKY",
    "variant": ""
  },
  "form_factor": "ATX Mid Tower",
  "color": [
    "BLACK"
  ],
  "power_supply": "None",
  "side_panel": "Tempered Glass",
  "has_transparent_side_panel": true,
  "front_panel_usb": "USB 3.2 Gen 2 Type-C                                                    USB 3.2 Gen 1 Type-A",
  "max_video_card_length": 400,
  "max_cpu_cooler_height": null,
  "internal_3_5_bays": 2,
  "internal_2_5_bays": 3,
  "expansion_slots": 7,
  "dimensions": "430 x 215 x 490",
  "volume": 45.3,
  "weight": null,
  "general_product_information": {
    "amazon_sku": "B0BNT962NF"
  }
}