{
  "opendb_id": "6c9b6699-8b45-44ef-b8e8-9c746dfef39f",
  "metadata": {
    "name": "Lian Li LANCOOL III ATX Mid Tower White with Tempered Glass Side Panel and USB 3.2 Gen 2 Type-C USB 3.2 Gen 1 Type-A",
    "manufacturer": "Lian Li",
    "part_numbers": [
      "LANCOOL 3-W                                                    Lancool III White                                                    G99.LAN3W.00"
    ],
    "series": "LANCOOL",
    "variant": ""
  },
  "form_factor": "ATX Mid Tower",
  "color": [
    "WHITE"
  ],
  "power_supply": "None",
  "side_panel": "Tempered Glass",
  "has_transparent_side_panel": true,
  "front_panel_usb": "USB 3.2 Gen 2 Type-C                                                    USB 3.2 Gen 1 Type-A",
  "max_video_card_length": 435,
  "max_cpu_cooler_height": null,
  "internal_3_5_bays": 4,
  "internal_2_5_bays": 8,
  "expansion_slots": 8,
  "dimensions": "526 x 238 x 523",
  "volume": 65.473,
  "weight": null,
  "general_product_information": {
    "newegg_sku": "N82E16811112604"
  }
}