{
  "opendb_id": "250fb2dc-0659-4155-b11c-dbc338d8c5ed",
  "metadata": {
    "name": "Lian Li A3-mATX Micro ATX Mini Tower White Mesh Side Panel, USB 3.2 Gen 2 Type-C, USB 3.2 Gen 1 Type-A",
    "manufacturer": "Lian Li",
    "part_numbers": [
      "A3-mATX-W                                                    A3- mATX White                                                    A3W.US                                                    PC-A3W"
    ],
    "series": "A3-mATX",
    "variant": ""
  },
  "form_factor": "Micro ATX Mini Tower",
  "color": [
    "WHITE"
  ],
  "power_supply": "None",
  "side_panel": "Mesh",
  "has_transparent_side_panel": true,
  "front_panel_usb": "USB 3.2 Gen 2 Type-C                                                    USB 3.2 Gen 1 Type-A",
  "max_video_card_length": 415,
  "max_cpu_cooler_height": null,
  "internal_3_5_bays": 1,
  "internal_2_5_bays": 2,
  "expansion_slots": 4,
  "dimensions": "443 x 194 x 306",
  "volume": 26.298,
  "weight": null,
  "supported_power_supply_form_factors": [],
  "front_usb_ports": [],
  "general_product_information": {
    "amazon_sku": "B0D5HCYZXR",
    "newegg_sku": "2AM-000Z-000D4"
  }
}