{
  "opendb_id": "5023f7f6-6ecf-424a-8f9f-530e89f35ed4",
  "metadata": {
    "name": "Aerocool Cronus ATX Mid Tower Black with Tempered Glass Side Panel and USB 3.2 Gen 1 Type-A",
    "manufacturer": "AeroCool",
    "part_numbers": [
      "ACCM-PB2301311                                                    Cronus-G-BK-v1                                                    ACCM-PB23013.11"
    ],
    "series": "Cronus",
    "variant": ""
  },
  "form_factor": "ATX Mid Tower",
  "color": [
    "BLACK"
  ],
  "power_supply": "None",
  "side_panel": "Tempered Glass",
  "has_transparent_side_panel": true,
  "front_panel_usb": "USB 3.2 Gen 1 Type-A",
  "max_video_card_length": 387,
  "max_cpu_cooler_height": null,
  "internal_3_5_bays": 3,
  "internal_2_5_bays": 4,
  "expansion_slots": 7,
  "dimensions": "468 x 230 x 502",
  "volume": 54.035,
  "weight": null,
  "supported_power_supply_form_factors": [],
  "front_usb_ports": [],
  "general_product_information": {
    "amazon_sku": "B08QJLZBQ7"
  }
}