{
  "opendb_id": "6ba4b85c-9a3d-4685-885f-f4aad333adda",
  "metadata": {
    "name": "Aerocool Prism V2 RGB ATX Mid Tower Black with Tempered Glass",
    "manufacturer": "Aerocool",
    "part_numbers": [
      "Prism-G-BK-v2"
    ],
    "series": "Prism",
    "variant": ""
  },
  "form_factor": "ATX Mid Tower",
  "color": [
    "BLACK"
  ],
  "power_supply": "None",
  "side_panel": "Tempered Glass",
  "has_transparent_side_panel": true,
  "front_panel_usb": "USB 3.2 Gen 1 Type-A                                                    USB 2.0 Type-A",
  "max_video_card_length": 346,
  "max_cpu_cooler_height": null,
  "internal_3_5_bays": 2,
  "internal_2_5_bays": 1,
  "expansion_slots": 7,
  "dimensions": "403 x 216.7 x 477",
  "volume": 41.656,
  "weight": null,
  "general_product_information": {}
}