{
  "opendb_id": "4afdd57b-9512-4301-8ec6-b28f18b2037a",
  "metadata": {
    "name": "APNX Creator C1 ATX Mid Tower Black Tempered Glass Side Panel",
    "manufacturer": "APNX",
    "part_numbers": [
      "APNX-C1-BK                                                    C1-BK-v1                                                    APCM-CR01043.11"
    ],
    "series": "Creator",
    "variant": ""
  },
  "form_factor": "ATX Mid Tower",
  "color": [
    "BLACK"
  ],
  "power_supply": "None",
  "side_panel": "Tempered Glass",
  "has_transparent_side_panel": true,
  "front_panel_usb": "USB 3.2 Gen 1 Type-C                                                    USB 3.2 Gen 1 Type-A",
  "max_video_card_length": 395,
  "max_cpu_cooler_height": null,
  "internal_3_5_bays": 3,
  "internal_2_5_bays": 0,
  "expansion_slots": 7,
  "dimensions": "464 x 230 x 502",
  "volume": 53.573,
  "weight": null,
  "general_product_information": {
    "amazon_sku": "B0CHMRKVZ5"
  }
}