{
  "opendb_id": "06fba849-864d-4331-84d6-eefe2eb07705",
  "metadata": {
    "name": "In Win A5 ATX Mid Tower Black Tempered Glass Side Panel, USB 3.2 Gen 2x2 Type-C, USB 3.2 Gen 1 Type-A",
    "manufacturer": "In Win",
    "part_numbers": [
      "A5 Black                                                    IW-CS-A5BLK-1AM120S"
    ],
    "series": "A5",
    "variant": ""
  },
  "form_factor": "ATX Mid Tower",
  "color": [
    "BLACK"
  ],
  "power_supply": "None",
  "side_panel": "Tempered Glass",
  "has_transparent_side_panel": true,
  "front_panel_usb": "USB 3.2 Gen 2x2 Type-C                                                    USB 3.2 Gen 1 Type-A",
  "max_video_card_length": 340,
  "max_cpu_cooler_height": null,
  "internal_3_5_bays": 2,
  "internal_2_5_bays": 2,
  "expansion_slots": 7,
  "dimensions": "399 x 215 x 407",
  "volume": 34.914,
  "weight": null,
  "general_product_information": {
    "amazon_sku": "B0BF2GDPDZ"
  }
}