{
  "opendb_id": "cb1c3f96-6aa3-491e-80ee-59302efd8e94",
  "metadata": {
    "name": "ENDORFY Ventum 200 Air ATX Mid Tower Black with Tempered Glass Side Panel and USB 3.2 Gen 1 Type-A",
    "manufacturer": "ENDORFY",
    "part_numbers": [
      "EY2A002"
    ],
    "series": "Ventum",
    "variant": ""
  },
  "form_factor": "ATX Mid Tower",
  "color": [
    "BLACK"
  ],
  "power_supply": "None",
  "side_panel": "Tempered Glass",
  "has_transparent_side_panel": true,
  "front_panel_usb": "USB 3.2 Gen 1 Type-A",
  "max_video_card_length": 315,
  "max_cpu_cooler_height": null,
  "internal_3_5_bays": 1,
  "internal_2_5_bays": 2,
  "expansion_slots": 7,
  "dimensions": "373 x 216 x 440",
  "volume": 35.45,
  "weight": null,
  "general_product_information": {}
}