{
  "opendb_id": "e68e0525-655c-459a-a1fc-c6a215b68c5c",
  "metadata": {
    "name": "Lian Li SUP01 ATX Mid Tower Black Tempered Glass Side Panel",
    "manufacturer": "Lian Li",
    "part_numbers": [
      "SUP01X                                                    G99.SUP01X.00"
    ],
    "series": "SUP01",
    "variant": ""
  },
  "form_factor": "ATX Mid Tower",
  "color": [
    "BLACK"
  ],
  "power_supply": "None",
  "side_panel": "Tempered Glass",
  "has_transparent_side_panel": true,
  "front_panel_usb": "USB 3.2 Gen 2 Type-C                                                    USB 3.2 Gen 1 Type-A",
  "max_video_card_length": 400,
  "max_cpu_cooler_height": null,
  "internal_3_5_bays": 2,
  "internal_2_5_bays": 2,
  "expansion_slots": 7,
  "dimensions": "403.5 x 212 x 534",
  "volume": 45.679,
  "weight": null,
  "supported_power_supply_form_factors": [],
  "front_usb_ports": [],
  "general_product_information": {
    "amazon_sku": "B0D82DZ7GG",
    "newegg_sku": "2AM-000Z-000D2"
  }
}