{
  "opendb_id": "dcb0469d-7e72-4b6f-a7a6-5fb53da3ba79",
  "metadata": {
    "name": "Silverstone FARA 511Z ATX Mid Tower Black Tempered Glass Side Panel",
    "manufacturer": "Silverstone",
    "part_numbers": [
      "SST-FA511Z-BG"
    ],
    "series": "FARA",
    "variant": ""
  },
  "form_factor": "ATX Mid Tower",
  "color": [
    "BLACK"
  ],
  "power_supply": "None",
  "side_panel": "Tempered Glass",
  "has_transparent_side_panel": true,
  "front_panel_usb": "USB 3.2 Gen 1 Type-A",
  "max_video_card_length": 360,
  "max_cpu_cooler_height": null,
  "internal_3_5_bays": 2,
  "internal_2_5_bays": 1,
  "expansion_slots": 7,
  "dimensions": "422.3 x 210 x 483.2",
  "volume": 42.852,
  "weight": null,
  "supported_power_supply_form_factors": [],
  "front_usb_ports": [],
  "general_product_information": {
    "amazon_sku": "B0BN4MLHQP",
    "newegg_sku": "N82E16811163426"
  }
}