{
  "opendb_id": "5dcd1a53-4690-4f5e-8c24-2d0bd5e6b8ab",
  "metadata": {
    "name": "be quiet! Pure Base 500 FX ATX Mid Tower Black Tempered Glass Side Panel",
    "manufacturer": "be quiet!",
    "part_numbers": [
      "BGW43"
    ],
    "series": "Pure",
    "variant": ""
  },
  "form_factor": "ATX Mid Tower",
  "color": [
    "BLACK"
  ],
  "power_supply": "None",
  "side_panel": "Tempered Glass",
  "has_transparent_side_panel": true,
  "front_panel_usb": "USB 3.2 Gen 2 Type-C                                                    USB 3.2 Gen 1 Type-A",
  "max_video_card_length": 369,
  "max_cpu_cooler_height": null,
  "internal_3_5_bays": 2,
  "internal_2_5_bays": 4,
  "expansion_slots": 7,
  "dimensions": "450 x 232 x 463",
  "volume": 48.337,
  "weight": null,
  "supported_power_supply_form_factors": [],
  "front_usb_ports": [],
  "general_product_information": {
    "amazon_sku": "B0B832WB3R",
    "newegg_sku": "2AM-0037-000A8"
  }
}