{
  "opendb_id": "dc33af89-64db-4688-b314-fb26c107dc04",
  "metadata": {
    "name": "DARKROCK Classico Storage Master ATX Mid Tower Black Mesh Side Panel",
    "manufacturer": "DARKROCK",
    "part_numbers": [
      "CP-CASE-DR-CLASSICO"
    ],
    "series": "Classico",
    "variant": ""
  },
  "form_factor": "ATX Mid Tower",
  "color": [
    "BLACK"
  ],
  "power_supply": "None",
  "side_panel": "Mesh",
  "has_transparent_side_panel": true,
  "front_panel_usb": "USB 3.2 Gen 1 Type-A",
  "max_video_card_length": 400,
  "max_cpu_cooler_height": null,
  "internal_3_5_bays": 10,
  "internal_2_5_bays": 3,
  "expansion_slots": 7,
  "dimensions": "",
  "volume": null,
  "weight": null,
  "general_product_information": {
    "amazon_sku": "B0CQZS7KN5"
  }
}