{
  "opendb_id": "3753b6ef-40fc-4762-86bc-d980ccf4f348",
  "metadata": {
    "name": "Thermaltake Ceres 350 MX ATX Mid Tower Green with Tempered Glass Side Panel and USB 3.2 Gen 2 Type-C, USB 3.2 Gen 1 Type-A",
    "manufacturer": "Thermaltake",
    "part_numbers": [
      "CA-1Z3-00MEWN-00"
    ],
    "series": "Ceres",
    "variant": ""
  },
  "form_factor": "ATX Mid Tower",
  "color": [
    "GREEN"
  ],
  "power_supply": "None",
  "side_panel": "Tempered Glass",
  "has_transparent_side_panel": true,
  "front_panel_usb": "USB 3.2 Gen 2 Type-C                                                    USB 3.2 Gen 1 Type-A",
  "max_video_card_length": 370,
  "max_cpu_cooler_height": null,
  "internal_3_5_bays": 1,
  "internal_2_5_bays": 2,
  "expansion_slots": 7,
  "dimensions": "463 x 245 x 463",
  "volume": 52.52,
  "weight": null,
  "general_product_information": {
    "newegg_sku": "N82E16811133553"
  }
}