{
  "opendb_id": "d6d441d9-a6ca-41db-acc2-7b221af8ef11",
  "metadata": {
    "name": "Deepcool CG530 ATX Mid Tower Black with Tempered Glass",
    "manufacturer": "DeepCool",
    "part_numbers": [
      "R-CG530-BKNDA0-G-1"
    ],
    "series": "CG530",
    "variant": "",
    "releaseYear": 2025
  },
  "form_factor": "ATX Mid Tower",
  "color": [
    "BLACK"
  ],
  "power_supply": "None",
  "side_panel": "Tempered Glass",
  "has_transparent_side_panel": true,
  "front_panel_usb": "USB 3.2 Gen 1 Type-A                                                    USB 2.0 Type-A",
  "max_video_card_length": 410,
  "max_cpu_cooler_height": 160,
  "internal_3_5_bays": 2,
  "internal_2_5_bays": 3,
  "expansion_slots": 7,
  "dimensions": "440 x 285 x 399",
  "volume": 50.035,
  "weight": 15,
  "supported_power_supply_form_factors": [],
  "front_usb_ports": [
    "2x USB 3.2 Gen 1 Type-A",
    "2x USB 3.2 Gen 1 Type-A"
  ],
  "power_supply_shroud": true,
  "supports_rear_connecting_motherboard": true,
  "dimensions_mm": {
    "width": 285,
    "height": 399,
    "depth": 440,
    "_id": "69234eb663659841264a23f0"
  },
  "general_product_information": {
    "manufacturer_url": "https://www.deepcool.com/products/Cases/CG530-Panoramic-Tempered-Glass-Panels-Dual-Chamber-ATX-FISHTANK-Case/2024/19577.shtml#group1-12"
  }
}