{
  "opendb_id": "f53a4227-3639-445d-b3d4-d3f5be9218dc",
  "metadata": {
    "name": "Antec C8 ATX Full Tower White Tempered Glass Side Panel",
    "manufacturer": "Antec",
    "part_numbers": [
      "0-761345-10028-1                                                    C8 ARGB White"
    ],
    "series": "C8",
    "variant": ""
  },
  "form_factor": "ATX Full Tower",
  "color": [
    "WHITE"
  ],
  "power_supply": "None",
  "side_panel": "Tempered Glass",
  "has_transparent_side_panel": true,
  "front_panel_usb": "USB 3.2 Gen 2 Type-C                                                    USB 3.2 Gen 1 Type-A",
  "max_video_card_length": 440,
  "max_cpu_cooler_height": null,
  "internal_3_5_bays": 2,
  "internal_2_5_bays": 4,
  "expansion_slots": 8,
  "dimensions": "464 x 303 x 476",
  "volume": 66.922,
  "weight": null,
  "general_product_information": {
    "amazon_sku": "B0CT27364G",
    "newegg_sku": "N82E16811129314"
  }
}