{
  "opendb_id": "8d7c3017-cb5c-4ed4-8c59-73aa3152ed42",
  "metadata": {
    "name": "MSI MPG VELOX 100R ATX Mid Tower Black Tempered Glass",
    "manufacturer": "MSI",
    "part_numbers": [
      "MPG VELOX 100R                                                    306-7G18R21-809"
    ],
    "series": "MPG",
    "variant": ""
  },
  "form_factor": "ATX Mid Tower",
  "color": [
    "BLACK"
  ],
  "power_supply": "None",
  "side_panel": "Tempered Glass",
  "has_transparent_side_panel": true,
  "front_panel_usb": "USB 3.2 Gen 2x2 Type-C                                                    USB 3.2 Gen 1 Type-A",
  "max_video_card_length": 380,
  "max_cpu_cooler_height": null,
  "internal_3_5_bays": 2,
  "internal_2_5_bays": 2,
  "expansion_slots": 7,
  "dimensions": "474 x 231 x 490",
  "volume": 53.652,
  "weight": null,
  "supported_power_supply_form_factors": [],
  "front_usb_ports": [],
  "general_product_information": {
    "amazon_sku": "B09HRQQ18B",
    "newegg_sku": "N82E16811320043",
    "bestbuy_sku": 6506729,
    "walmart_sku": 949264663
  }
}